{
  "table_name": "contracts",
  "columns": [
    {
      "Field": "contract_id",
      "Type": "varchar(10)",
      "Null": "NO",
      "Key": "PRI",
      "Default": null,
      "Extra": ""
    },
    {
      "Field": "contract_type",
      "Type": "varchar(10)",
      "Null": "YES",
      "Key": "",
      "Default": null,
      "Extra": ""
    },
    {
      "Field": "contract_name",
      "Type": "varchar(50)",
      "Null": "YES",
      "Key": "",
      "Default": null,
      "Extra": ""
    },
    {
      "Field": "contract_credit",
      "Type": "int(11)",
      "Null": "YES",
      "Key": "",
      "Default": null,
      "Extra": ""
    },
    {
      "Field": "contract_LS",
      "Type": "int(11)",
      "Null": "YES",
      "Key": "",
      "Default": null,
      "Extra": ""
    },
    {
      "Field": "contract_status",
      "Type": "varchar(20)",
      "Null": "YES",
      "Key": "",
      "Default": null,
      "Extra": ""
    },
    {
      "Field": "price",
      "Type": "int(11)",
      "Null": "YES",
      "Key": "",
      "Default": null,
      "Extra": ""
    },
    {
      "Field": "effect_month",
      "Type": "int(11)",
      "Null": "YES",
      "Key": "",
      "Default": null,
      "Extra": ""
    },
    {
      "Field": "sell_by_credit_price",
      "Type": "int(11)",
      "Null": "YES",
      "Key": "",
      "Default": "0",
      "Extra": ""
    },
    {
      "Field": "contract_category",
      "Type": "varchar(10)",
      "Null": "NO",
      "Key": "",
      "Default": null,
      "Extra": ""
    },
    {
      "Field": "contract_junior_lesson",
      "Type": "int(11)",
      "Null": "YES",
      "Key": "",
      "Default": null,
      "Extra": ""
    },
    {
      "Field": "LS_type",
      "Type": "varchar(20)",
      "Null": "YES",
      "Key": "",
      "Default": null,
      "Extra": ""
    },
    {
      "Field": "branch_id",
      "Type": "varchar(20)",
      "Null": "YES",
      "Key": "",
      "Default": null,
      "Extra": ""
    }
  ],
  "create_statement": "CREATE TABLE `contracts` (\n  `contract_id` varchar(10) NOT NULL,\n  `contract_type` varchar(10) DEFAULT NULL,\n  `contract_name` varchar(50) DEFAULT NULL,\n  `contract_credit` int(11) DEFAULT NULL,\n  `contract_LS` int(11) DEFAULT NULL,\n  `contract_status` varchar(20) DEFAULT NULL,\n  `price` int(11) DEFAULT NULL,\n  `effect_month` int(11) DEFAULT NULL,\n  `sell_by_credit_price` int(11) DEFAULT 0,\n  `contract_category` varchar(10) NOT NULL,\n  `contract_junior_lesson` int(11) DEFAULT NULL,\n  `LS_type` varchar(20) DEFAULT NULL,\n  `branch_id` varchar(20) DEFAULT NULL,\n  PRIMARY KEY (`contract_id`)\n) ENGINE=InnoDB DEFAULT CHARSET=utf8mb4 COLLATE=utf8mb4_unicode_ci",
  "indexes": [
    {
      "Table": "contracts",
      "Non_unique": 0,
      "Key_name": "PRIMARY",
      "Seq_in_index": 1,
      "Column_name": "contract_id",
      "Collation": "A",
      "Cardinality": 169,
      "Sub_part": null,
      "Packed": null,
      "Null": "",
      "Index_type": "BTREE",
      "Comment": ""
    }
  ],
  "backup_timestamp": "2025-11-27T21:08:17.217531"
}