{
  "table_name": "FMS_LS",
  "columns": [
    {
      "Field": "LS_id",
      "Type": "varchar(15)",
      "Null": "NO",
      "Key": "PRI",
      "Default": null,
      "Extra": ""
    },
    {
      "Field": "프로_이름",
      "Type": "varchar(10)",
      "Null": "YES",
      "Key": "",
      "Default": null,
      "Extra": ""
    },
    {
      "Field": "LS_date",
      "Type": "date",
      "Null": "YES",
      "Key": "",
      "Default": null,
      "Extra": ""
    },
    {
      "Field": "시간대",
      "Type": "int(11)",
      "Null": "YES",
      "Key": "",
      "Default": null,
      "Extra": ""
    },
    {
      "Field": "LS_start_time",
      "Type": "time",
      "Null": "YES",
      "Key": "",
      "Default": null,
      "Extra": ""
    },
    {
      "Field": "LS_end_time",
      "Type": "time",
      "Null": "YES",
      "Key": "",
      "Default": null,
      "Extra": ""
    },
    {
      "Field": "LS_duration",
      "Type": "int(11)",
      "Null": "YES",
      "Key": "",
      "Default": null,
      "Extra": ""
    },
    {
      "Field": "결제상태",
      "Type": "varchar(20)",
      "Null": "YES",
      "Key": "",
      "Default": null,
      "Extra": ""
    },
    {
      "Field": "예약자명",
      "Type": "varchar(50)",
      "Null": "YES",
      "Key": "",
      "Default": null,
      "Extra": ""
    },
    {
      "Field": "연락처",
      "Type": "varchar(20)",
      "Null": "YES",
      "Key": "",
      "Default": null,
      "Extra": ""
    },
    {
      "Field": "LS_category",
      "Type": "varchar(20)",
      "Null": "YES",
      "Key": "",
      "Default": null,
      "Extra": ""
    },
    {
      "Field": "LS_order_qty",
      "Type": "int(11)",
      "Null": "YES",
      "Key": "",
      "Default": null,
      "Extra": ""
    },
    {
      "Field": "member_id",
      "Type": "int(11)",
      "Null": "YES",
      "Key": "",
      "Default": null,
      "Extra": ""
    },
    {
      "Field": "junior_id",
      "Type": "int(11)",
      "Null": "YES",
      "Key": "",
      "Default": null,
      "Extra": ""
    },
    {
      "Field": "updated_at",
      "Type": "timestamp",
      "Null": "NO",
      "Key": "",
      "Default": "current_timestamp()",
      "Extra": "on update current_timestamp()"
    },
    {
      "Field": "branch_id",
      "Type": "varchar(20)",
      "Null": "YES",
      "Key": "",
      "Default": null,
      "Extra": ""
    }
  ],
  "create_statement": "CREATE TABLE `FMS_LS` (\n  `LS_id` varchar(15) NOT NULL,\n  `프로_이름` varchar(10) DEFAULT NULL,\n  `LS_date` date DEFAULT NULL,\n  `시간대` int(11) DEFAULT NULL,\n  `LS_start_time` time DEFAULT NULL,\n  `LS_end_time` time DEFAULT NULL,\n  `LS_duration` int(11) DEFAULT NULL,\n  `결제상태` varchar(20) DEFAULT NULL,\n  `예약자명` varchar(50) DEFAULT NULL,\n  `연락처` varchar(20) DEFAULT NULL,\n  `LS_category` varchar(20) DEFAULT NULL,\n  `LS_order_qty` int(11) DEFAULT NULL,\n  `member_id` int(11) DEFAULT NULL,\n  `junior_id` int(11) DEFAULT NULL,\n  `updated_at` timestamp NOT NULL DEFAULT current_timestamp() ON UPDATE current_timestamp(),\n  `branch_id` varchar(20) DEFAULT NULL,\n  PRIMARY KEY (`LS_id`)\n) ENGINE=InnoDB DEFAULT CHARSET=utf8mb4 COLLATE=utf8mb4_unicode_ci",
  "indexes": [
    {
      "Table": "FMS_LS",
      "Non_unique": 0,
      "Key_name": "PRIMARY",
      "Seq_in_index": 1,
      "Column_name": "LS_id",
      "Collation": "A",
      "Cardinality": 11599,
      "Sub_part": null,
      "Packed": null,
      "Null": "",
      "Index_type": "BTREE",
      "Comment": ""
    }
  ],
  "backup_timestamp": "2025-11-27T21:08:11.862030"
}