{
  "table_name": "LS_countings",
  "columns": [
    {
      "Field": "LS_id",
      "Type": "varchar(30)",
      "Null": "NO",
      "Key": "PRI",
      "Default": null,
      "Extra": ""
    },
    {
      "Field": "member_id",
      "Type": "int(11)",
      "Null": "YES",
      "Key": "",
      "Default": null,
      "Extra": ""
    },
    {
      "Field": "LS_contract_id",
      "Type": "int(11)",
      "Null": "YES",
      "Key": "",
      "Default": null,
      "Extra": ""
    },
    {
      "Field": "member_name",
      "Type": "varchar(20)",
      "Null": "YES",
      "Key": "",
      "Default": null,
      "Extra": ""
    },
    {
      "Field": "LS_balance_before",
      "Type": "int(11)",
      "Null": "YES",
      "Key": "",
      "Default": null,
      "Extra": ""
    },
    {
      "Field": "LS_net_qty",
      "Type": "int(11)",
      "Null": "YES",
      "Key": "",
      "Default": null,
      "Extra": ""
    },
    {
      "Field": "LS_balance_after",
      "Type": "int(11)",
      "Null": "YES",
      "Key": "",
      "Default": null,
      "Extra": ""
    },
    {
      "Field": "LS_counting_source",
      "Type": "varchar(20)",
      "Null": "YES",
      "Key": "",
      "Default": null,
      "Extra": ""
    },
    {
      "Field": "updated_at",
      "Type": "timestamp",
      "Null": "NO",
      "Key": "",
      "Default": "current_timestamp()",
      "Extra": "on update current_timestamp()"
    },
    {
      "Field": "LS_type",
      "Type": "varchar(15)",
      "Null": "YES",
      "Key": "",
      "Default": null,
      "Extra": ""
    },
    {
      "Field": "junior_id",
      "Type": "int(11)",
      "Null": "YES",
      "Key": "",
      "Default": null,
      "Extra": ""
    },
    {
      "Field": "branch_id",
      "Type": "varchar(20)",
      "Null": "YES",
      "Key": "",
      "Default": null,
      "Extra": ""
    }
  ],
  "create_statement": "CREATE TABLE `LS_countings` (\n  `LS_id` varchar(30) NOT NULL,\n  `member_id` int(11) DEFAULT NULL,\n  `LS_contract_id` int(11) DEFAULT NULL,\n  `member_name` varchar(20) DEFAULT NULL,\n  `LS_balance_before` int(11) DEFAULT NULL,\n  `LS_net_qty` int(11) DEFAULT NULL,\n  `LS_balance_after` int(11) DEFAULT NULL,\n  `LS_counting_source` varchar(20) DEFAULT NULL,\n  `updated_at` timestamp NOT NULL DEFAULT current_timestamp() ON UPDATE current_timestamp(),\n  `LS_type` varchar(15) DEFAULT NULL,\n  `junior_id` int(11) DEFAULT NULL,\n  `branch_id` varchar(20) DEFAULT NULL,\n  PRIMARY KEY (`LS_id`)\n) ENGINE=InnoDB DEFAULT CHARSET=utf8mb4 COLLATE=utf8mb4_unicode_ci",
  "indexes": [
    {
      "Table": "LS_countings",
      "Non_unique": 0,
      "Key_name": "PRIMARY",
      "Seq_in_index": 1,
      "Column_name": "LS_id",
      "Collation": "A",
      "Cardinality": 16044,
      "Sub_part": null,
      "Packed": null,
      "Null": "",
      "Index_type": "BTREE",
      "Comment": ""
    }
  ],
  "backup_timestamp": "2025-11-27T21:08:13.762522"
}