{
  "table_name": "LS_history",
  "columns": [
    {
      "Field": "LS_history_id",
      "Type": "int(11)",
      "Null": "NO",
      "Key": "PRI",
      "Default": null,
      "Extra": "auto_increment"
    },
    {
      "Field": "member_id",
      "Type": "int(11)",
      "Null": "YES",
      "Key": "",
      "Default": null,
      "Extra": ""
    },
    {
      "Field": "member_name",
      "Type": "varchar(255)",
      "Null": "YES",
      "Key": "",
      "Default": null,
      "Extra": ""
    },
    {
      "Field": "member_phone",
      "Type": "varchar(20)",
      "Null": "YES",
      "Key": "",
      "Default": null,
      "Extra": ""
    },
    {
      "Field": "booking_date",
      "Type": "date",
      "Null": "YES",
      "Key": "",
      "Default": null,
      "Extra": ""
    },
    {
      "Field": "pro_name",
      "Type": "varchar(255)",
      "Null": "YES",
      "Key": "",
      "Default": null,
      "Extra": ""
    },
    {
      "Field": "product_name",
      "Type": "varchar(255)",
      "Null": "YES",
      "Key": "",
      "Default": null,
      "Extra": ""
    },
    {
      "Field": "booking_time",
      "Type": "varchar(20)",
      "Null": "YES",
      "Key": "",
      "Default": null,
      "Extra": ""
    },
    {
      "Field": "booking_route",
      "Type": "varchar(20)",
      "Null": "YES",
      "Key": "",
      "Default": null,
      "Extra": ""
    },
    {
      "Field": "status",
      "Type": "varchar(20)",
      "Null": "YES",
      "Key": "",
      "Default": null,
      "Extra": ""
    },
    {
      "Field": "lesson_start_time",
      "Type": "varchar(5)",
      "Null": "YES",
      "Key": "",
      "Default": null,
      "Extra": ""
    },
    {
      "Field": "lesson_end_time",
      "Type": "varchar(5)",
      "Null": "YES",
      "Key": "",
      "Default": null,
      "Extra": ""
    },
    {
      "Field": "lesson_duration",
      "Type": "varchar(3)",
      "Null": "YES",
      "Key": "",
      "Default": null,
      "Extra": ""
    },
    {
      "Field": "lesson_confirm",
      "Type": "varchar(100)",
      "Null": "YES",
      "Key": "",
      "Default": null,
      "Extra": ""
    },
    {
      "Field": "lesson_status_confirm",
      "Type": "varchar(10)",
      "Null": "YES",
      "Key": "",
      "Default": null,
      "Extra": ""
    },
    {
      "Field": "lesson_status",
      "Type": "varchar(100)",
      "Null": "YES",
      "Key": "",
      "Default": null,
      "Extra": ""
    },
    {
      "Field": "LS_id",
      "Type": "varchar(20)",
      "Null": "YES",
      "Key": "",
      "Default": null,
      "Extra": ""
    },
    {
      "Field": "branch_id",
      "Type": "varchar(20)",
      "Null": "YES",
      "Key": "",
      "Default": null,
      "Extra": ""
    }
  ],
  "create_statement": "CREATE TABLE `LS_history` (\n  `LS_history_id` int(11) NOT NULL AUTO_INCREMENT,\n  `member_id` int(11) DEFAULT NULL,\n  `member_name` varchar(255) DEFAULT NULL,\n  `member_phone` varchar(20) DEFAULT NULL,\n  `booking_date` date DEFAULT NULL,\n  `pro_name` varchar(255) DEFAULT NULL,\n  `product_name` varchar(255) DEFAULT NULL,\n  `booking_time` varchar(20) DEFAULT NULL,\n  `booking_route` varchar(20) DEFAULT NULL,\n  `status` varchar(20) DEFAULT NULL,\n  `lesson_start_time` varchar(5) DEFAULT NULL,\n  `lesson_end_time` varchar(5) DEFAULT NULL,\n  `lesson_duration` varchar(3) DEFAULT NULL,\n  `lesson_confirm` varchar(100) DEFAULT NULL,\n  `lesson_status_confirm` varchar(10) DEFAULT NULL,\n  `lesson_status` varchar(100) DEFAULT NULL,\n  `LS_id` varchar(20) DEFAULT NULL,\n  `branch_id` varchar(20) DEFAULT NULL,\n  PRIMARY KEY (`LS_history_id`)\n) ENGINE=InnoDB DEFAULT CHARSET=utf8mb4 COLLATE=utf8mb4_unicode_ci",
  "indexes": [
    {
      "Table": "LS_history",
      "Non_unique": 0,
      "Key_name": "PRIMARY",
      "Seq_in_index": 1,
      "Column_name": "LS_history_id",
      "Collation": "A",
      "Cardinality": 0,
      "Sub_part": null,
      "Packed": null,
      "Null": "",
      "Index_type": "BTREE",
      "Comment": ""
    }
  ],
  "backup_timestamp": "2025-11-27T21:08:14.052580"
}