{
  "table_name": "members",
  "columns": [
    {
      "Field": "member_id",
      "Type": "int(11)",
      "Null": "NO",
      "Key": "PRI",
      "Default": null,
      "Extra": "auto_increment"
    },
    {
      "Field": "member_name",
      "Type": "varchar(20)",
      "Null": "YES",
      "Key": "",
      "Default": null,
      "Extra": ""
    },
    {
      "Field": "member_phone",
      "Type": "varchar(20)",
      "Null": "YES",
      "Key": "",
      "Default": null,
      "Extra": ""
    },
    {
      "Field": "member_chn_keyword",
      "Type": "varchar(30)",
      "Null": "YES",
      "Key": "",
      "Default": null,
      "Extra": ""
    },
    {
      "Field": "member_nickname",
      "Type": "varchar(20)",
      "Null": "YES",
      "Key": "",
      "Default": null,
      "Extra": ""
    },
    {
      "Field": "member_gender",
      "Type": "varchar(10)",
      "Null": "YES",
      "Key": "",
      "Default": null,
      "Extra": ""
    },
    {
      "Field": "member_address",
      "Type": "text",
      "Null": "YES",
      "Key": "",
      "Default": null,
      "Extra": ""
    },
    {
      "Field": "member_birthday",
      "Type": "date",
      "Null": "YES",
      "Key": "",
      "Default": null,
      "Extra": ""
    },
    {
      "Field": "member_status_memo",
      "Type": "varchar(20)",
      "Null": "YES",
      "Key": "",
      "Default": null,
      "Extra": ""
    },
    {
      "Field": "member_register",
      "Type": "timestamp",
      "Null": "YES",
      "Key": "",
      "Default": null,
      "Extra": ""
    },
    {
      "Field": "member_memo",
      "Type": "text",
      "Null": "YES",
      "Key": "",
      "Default": null,
      "Extra": ""
    },
    {
      "Field": "member_password",
      "Type": "varchar(20)",
      "Null": "NO",
      "Key": "",
      "Default": "1111",
      "Extra": ""
    },
    {
      "Field": "member_update",
      "Type": "timestamp",
      "Null": "YES",
      "Key": "",
      "Default": null,
      "Extra": ""
    },
    {
      "Field": "branch_id",
      "Type": "varchar(20)",
      "Null": "YES",
      "Key": "",
      "Default": null,
      "Extra": ""
    }
  ],
  "create_statement": "CREATE TABLE `members` (\n  `member_id` int(11) NOT NULL AUTO_INCREMENT,\n  `member_name` varchar(20) DEFAULT NULL,\n  `member_phone` varchar(20) DEFAULT NULL,\n  `member_chn_keyword` varchar(30) DEFAULT NULL,\n  `member_nickname` varchar(20) DEFAULT NULL,\n  `member_gender` varchar(10) DEFAULT NULL,\n  `member_address` text DEFAULT NULL,\n  `member_birthday` date DEFAULT NULL,\n  `member_status_memo` varchar(20) DEFAULT NULL,\n  `member_register` timestamp NULL DEFAULT NULL,\n  `member_memo` text DEFAULT NULL,\n  `member_password` varchar(20) NOT NULL DEFAULT '1111',\n  `member_update` timestamp NULL DEFAULT NULL,\n  `branch_id` varchar(20) DEFAULT NULL,\n  PRIMARY KEY (`member_id`)\n) ENGINE=InnoDB AUTO_INCREMENT=882 DEFAULT CHARSET=utf8mb4 COLLATE=utf8mb4_unicode_ci",
  "indexes": [
    {
      "Table": "members",
      "Non_unique": 0,
      "Key_name": "PRIMARY",
      "Seq_in_index": 1,
      "Column_name": "member_id",
      "Collation": "A",
      "Cardinality": 1061,
      "Sub_part": null,
      "Packed": null,
      "Null": "",
      "Index_type": "BTREE",
      "Comment": ""
    }
  ],
  "backup_timestamp": "2025-11-27T21:08:17.292148"
}