{
  "table_name": "Priced_FMS",
  "columns": [
    {
      "Field": "reservation_id",
      "Type": "varchar(50)",
      "Null": "NO",
      "Key": "PRI",
      "Default": null,
      "Extra": ""
    },
    {
      "Field": "ts_id",
      "Type": "varchar(10)",
      "Null": "YES",
      "Key": "",
      "Default": null,
      "Extra": ""
    },
    {
      "Field": "ts_date",
      "Type": "date",
      "Null": "YES",
      "Key": "",
      "Default": null,
      "Extra": ""
    },
    {
      "Field": "ts_start",
      "Type": "time",
      "Null": "YES",
      "Key": "",
      "Default": null,
      "Extra": ""
    },
    {
      "Field": "ts_end",
      "Type": "time",
      "Null": "YES",
      "Key": "",
      "Default": null,
      "Extra": ""
    },
    {
      "Field": "ts_type",
      "Type": "varchar(20)",
      "Null": "YES",
      "Key": "",
      "Default": null,
      "Extra": ""
    },
    {
      "Field": "member_id",
      "Type": "int(11)",
      "Null": "YES",
      "Key": "",
      "Default": null,
      "Extra": ""
    },
    {
      "Field": "member_name_fms",
      "Type": "varchar(50)",
      "Null": "YES",
      "Key": "",
      "Default": null,
      "Extra": ""
    },
    {
      "Field": "member_phone",
      "Type": "varchar(20)",
      "Null": "YES",
      "Key": "",
      "Default": null,
      "Extra": ""
    },
    {
      "Field": "total_amt",
      "Type": "int(11)",
      "Null": "YES",
      "Key": "",
      "Default": null,
      "Extra": ""
    },
    {
      "Field": "term_discount",
      "Type": "int(11)",
      "Null": "YES",
      "Key": "",
      "Default": null,
      "Extra": ""
    },
    {
      "Field": "junior_discount",
      "Type": "int(11)",
      "Null": "YES",
      "Key": "",
      "Default": null,
      "Extra": ""
    },
    {
      "Field": "overtime_discount",
      "Type": "int(11)",
      "Null": "YES",
      "Key": "",
      "Default": null,
      "Extra": ""
    },
    {
      "Field": "revisit_discount_today",
      "Type": "int(11)",
      "Null": "YES",
      "Key": "",
      "Default": null,
      "Extra": ""
    },
    {
      "Field": "emergency_discount",
      "Type": "int(11)",
      "Null": "YES",
      "Key": "",
      "Default": "0",
      "Extra": ""
    },
    {
      "Field": "emergency_reason",
      "Type": "varchar(100)",
      "Null": "YES",
      "Key": "",
      "Default": null,
      "Extra": ""
    },
    {
      "Field": "total_discount",
      "Type": "int(11)",
      "Null": "YES",
      "Key": "",
      "Default": null,
      "Extra": ""
    },
    {
      "Field": "net_amt",
      "Type": "int(11)",
      "Null": "YES",
      "Key": "",
      "Default": null,
      "Extra": ""
    },
    {
      "Field": "revisit_date",
      "Type": "date",
      "Null": "YES",
      "Key": "",
      "Default": null,
      "Extra": ""
    },
    {
      "Field": "revisit_discount",
      "Type": "int(11)",
      "Null": "YES",
      "Key": "",
      "Default": null,
      "Extra": ""
    },
    {
      "Field": "morning",
      "Type": "int(11)",
      "Null": "YES",
      "Key": "",
      "Default": null,
      "Extra": ""
    },
    {
      "Field": "normal",
      "Type": "int(11)",
      "Null": "YES",
      "Key": "",
      "Default": null,
      "Extra": ""
    },
    {
      "Field": "peak",
      "Type": "int(11)",
      "Null": "YES",
      "Key": "",
      "Default": null,
      "Extra": ""
    },
    {
      "Field": "night",
      "Type": "int(11)",
      "Null": "YES",
      "Key": "",
      "Default": null,
      "Extra": ""
    },
    {
      "Field": "ts_min",
      "Type": "int(11)",
      "Null": "YES",
      "Key": "",
      "Default": null,
      "Extra": ""
    },
    {
      "Field": "time_stamp",
      "Type": "datetime",
      "Null": "YES",
      "Key": "",
      "Default": null,
      "Extra": ""
    },
    {
      "Field": "branch_id",
      "Type": "varchar(20)",
      "Null": "YES",
      "Key": "",
      "Default": null,
      "Extra": ""
    }
  ],
  "create_statement": "CREATE TABLE `Priced_FMS` (\n  `reservation_id` varchar(50) NOT NULL,\n  `ts_id` varchar(10) DEFAULT NULL,\n  `ts_date` date DEFAULT NULL,\n  `ts_start` time DEFAULT NULL,\n  `ts_end` time DEFAULT NULL,\n  `ts_type` varchar(20) DEFAULT NULL,\n  `member_id` int(11) DEFAULT NULL,\n  `member_name_fms` varchar(50) DEFAULT NULL,\n  `member_phone` varchar(20) DEFAULT NULL,\n  `total_amt` int(11) DEFAULT NULL,\n  `term_discount` int(11) DEFAULT NULL,\n  `junior_discount` int(11) DEFAULT NULL,\n  `overtime_discount` int(11) DEFAULT NULL,\n  `revisit_discount_today` int(11) DEFAULT NULL,\n  `emergency_discount` int(11) DEFAULT 0,\n  `emergency_reason` varchar(100) DEFAULT NULL,\n  `total_discount` int(11) DEFAULT NULL,\n  `net_amt` int(11) DEFAULT NULL,\n  `revisit_date` date DEFAULT NULL,\n  `revisit_discount` int(11) DEFAULT NULL,\n  `morning` int(11) DEFAULT NULL,\n  `normal` int(11) DEFAULT NULL,\n  `peak` int(11) DEFAULT NULL,\n  `night` int(11) DEFAULT NULL,\n  `ts_min` int(11) DEFAULT NULL,\n  `time_stamp` datetime DEFAULT NULL,\n  `branch_id` varchar(20) DEFAULT NULL,\n  PRIMARY KEY (`reservation_id`)\n) ENGINE=InnoDB DEFAULT CHARSET=utf8mb4 COLLATE=utf8mb4_unicode_ci",
  "indexes": [
    {
      "Table": "Priced_FMS",
      "Non_unique": 0,
      "Key_name": "PRIMARY",
      "Seq_in_index": 1,
      "Column_name": "reservation_id",
      "Collation": "A",
      "Cardinality": 29593,
      "Sub_part": null,
      "Packed": null,
      "Null": "",
      "Index_type": "BTREE",
      "Comment": ""
    }
  ],
  "backup_timestamp": "2025-11-27T21:08:14.849705"
}