{
  "table_name": "TS_usage",
  "columns": [
    {
      "Field": "ts_id",
      "Type": "int(11)",
      "Null": "NO",
      "Key": "PRI",
      "Default": null,
      "Extra": "auto_increment"
    },
    {
      "Field": "member_id",
      "Type": "int(11)",
      "Null": "YES",
      "Key": "",
      "Default": null,
      "Extra": ""
    },
    {
      "Field": "ts_date",
      "Type": "date",
      "Null": "YES",
      "Key": "",
      "Default": null,
      "Extra": ""
    },
    {
      "Field": "ts_start",
      "Type": "time",
      "Null": "YES",
      "Key": "",
      "Default": null,
      "Extra": ""
    },
    {
      "Field": "ts_end",
      "Type": "time",
      "Null": "YES",
      "Key": "",
      "Default": null,
      "Extra": ""
    },
    {
      "Field": "ts_type",
      "Type": "varchar(30)",
      "Null": "YES",
      "Key": "",
      "Default": null,
      "Extra": ""
    },
    {
      "Field": "ts_min",
      "Type": "int(11)",
      "Null": "YES",
      "Key": "",
      "Default": null,
      "Extra": ""
    },
    {
      "Field": "morning_min",
      "Type": "int(11)",
      "Null": "YES",
      "Key": "",
      "Default": null,
      "Extra": ""
    },
    {
      "Field": "normal_min",
      "Type": "int(11)",
      "Null": "YES",
      "Key": "",
      "Default": null,
      "Extra": ""
    },
    {
      "Field": "peak_min",
      "Type": "int(11)",
      "Null": "YES",
      "Key": "",
      "Default": null,
      "Extra": ""
    },
    {
      "Field": "night_min",
      "Type": "int(11)",
      "Null": "YES",
      "Key": "",
      "Default": null,
      "Extra": ""
    },
    {
      "Field": "total_amt",
      "Type": "int(11)",
      "Null": "YES",
      "Key": "",
      "Default": null,
      "Extra": ""
    },
    {
      "Field": "term_discount",
      "Type": "int(11)",
      "Null": "YES",
      "Key": "",
      "Default": null,
      "Extra": ""
    },
    {
      "Field": "junior_discount",
      "Type": "int(11)",
      "Null": "YES",
      "Key": "",
      "Default": null,
      "Extra": ""
    },
    {
      "Field": "overtime_discount",
      "Type": "int(11)",
      "Null": "YES",
      "Key": "",
      "Default": null,
      "Extra": ""
    },
    {
      "Field": "revisit_discount_today",
      "Type": "int(11)",
      "Null": "YES",
      "Key": "",
      "Default": null,
      "Extra": ""
    },
    {
      "Field": "total_discount",
      "Type": "int(11)",
      "Null": "YES",
      "Key": "",
      "Default": null,
      "Extra": ""
    },
    {
      "Field": "net_amt",
      "Type": "int(11)",
      "Null": "YES",
      "Key": "",
      "Default": null,
      "Extra": ""
    },
    {
      "Field": "reservation_id",
      "Type": "varchar(30)",
      "Null": "YES",
      "Key": "",
      "Default": null,
      "Extra": ""
    },
    {
      "Field": "branch_id",
      "Type": "varchar(20)",
      "Null": "YES",
      "Key": "",
      "Default": null,
      "Extra": ""
    }
  ],
  "create_statement": "CREATE TABLE `TS_usage` (\n  `ts_id` int(11) NOT NULL AUTO_INCREMENT,\n  `member_id` int(11) DEFAULT NULL,\n  `ts_date` date DEFAULT NULL,\n  `ts_start` time DEFAULT NULL,\n  `ts_end` time DEFAULT NULL,\n  `ts_type` varchar(30) DEFAULT NULL,\n  `ts_min` int(11) DEFAULT NULL,\n  `morning_min` int(11) DEFAULT NULL,\n  `normal_min` int(11) DEFAULT NULL,\n  `peak_min` int(11) DEFAULT NULL,\n  `night_min` int(11) DEFAULT NULL,\n  `total_amt` int(11) DEFAULT NULL,\n  `term_discount` int(11) DEFAULT NULL,\n  `junior_discount` int(11) DEFAULT NULL,\n  `overtime_discount` int(11) DEFAULT NULL,\n  `revisit_discount_today` int(11) DEFAULT NULL,\n  `total_discount` int(11) DEFAULT NULL,\n  `net_amt` int(11) DEFAULT NULL,\n  `reservation_id` varchar(30) DEFAULT NULL,\n  `branch_id` varchar(20) DEFAULT NULL,\n  PRIMARY KEY (`ts_id`)\n) ENGINE=InnoDB AUTO_INCREMENT=3 DEFAULT CHARSET=utf8mb4 COLLATE=utf8mb4_unicode_ci",
  "indexes": [
    {
      "Table": "TS_usage",
      "Non_unique": 0,
      "Key_name": "PRIMARY",
      "Seq_in_index": 1,
      "Column_name": "ts_id",
      "Collation": "A",
      "Cardinality": 1,
      "Sub_part": null,
      "Packed": null,
      "Null": "",
      "Index_type": "BTREE",
      "Comment": ""
    }
  ],
  "backup_timestamp": "2025-11-27T21:08:16.010425"
}